Sentence,Tag
"Jo Actor apni har movie se Pyaar failata hai, uske fans dusre actors ko hate karte hain to accha nahi lagta #Irony @benaam_gumnaam @SRKEmmi",Sarcasm
ye #Bollywood wale kya jaane sansar ki baatein. koi kuch bhi comment pel deta hai. pic.twitter.com/AlQUfvk0Ga,Non-sarcasm
Kal m ja rha MAYOR banne   Shree Dinesh Sharma Ji ne Mayor(Lucknow) ki seat mere liye chod di  #Sarcasm,Sarcasm
Dekhta hai kabhi cricket sale tere jaise 10 khde ho Jaye na ek ke upar ek tab bhi bouncer nhi khel payega or na hi seam Smaj payega,Non-sarcasm
Aaj ki special thali #Snap #Sarcasm. Langar hai. Aaj to koi nahi milega galti se bhi.,Sarcasm
"Kam se kam is Waqt politics chor do. Tum logo ka bhagwan se bhi dar nahi hai kya? Bacche mare hai logo ke, aur tum ko apni siyasat chamkani",Non-sarcasm
"Mubarak ho..Mithaaiyaan baato..Beta hua hai, Baap ki khushi.  Aaj wahi Beta ladkiyon ki DP laga ke followrs gain karne me laga hai. #Irony",Sarcasm
JHOOTA! RT @abdulsamadskhan: @Samra_Noori #SomethingIGetALot yaar bohat weight loose kiya hai tumne? #Sarcasm,Non-sarcasm
