Sentence,Tag
white house increases security after man shows up at oval office looking for obama,Sarcasm
exclusive promo hints stephen colbert will unleash on trump in live election show,Non-sarcasm
trump regrets choosing kavanaugh after supreme court nominee keeps talking about how much he respects women,Sarcasm
orange workout gear that'll legitimately up your gym game,Non-sarcasm
jackie chan's ancestors shamed by blooper reel,Sarcasm
"gorsuch, like thomas, will get his big payback",Non-sarcasm
biden urges paul ryan to check out nude scene from 'porky's' on phone,Sarcasm
heidi cruz gets a boost in new york from trump 'nastiness' backlash,Non-sarcasm
